Poster_Link;Series_Title;Released_Year;Certificate;Runtime;Genre;IMDB_Rating;Overview;Meta_score;Director;Star1;Star2;Star3;Star4
https://m.media-amazon.com/images/M/MV5BMjEzMzA4NDE2OF5BMl5BanBnXkFtZTcwNTc5MDI2NQ@@._V1_UX67_CR0;Rashômon;1950;;88 min;Crime, Drama, Mystery;08.feb;The rape of a bride and the murder of her samurai husband are recalled from the perspectives of a bandit, the bride, the samurai's ghost and a woodcutter.;98;Akira Kurosawa;Toshirô Mifune;Machiko Kyô;Masayuki Mori;Takashi Shimura
https://m.media-amazon.com/images/M/MV5BMTY2MTAzODI5NV5BMl5BanBnXkFtZTgwMjM4NzQ0MjE@._V1_UX67_CR0;All About Eve;1950;Passed;138 min;Drama;08.feb;A seemingly timid but secretly ruthless ingénue insinuates herself into the lives of an aging Broadway star and her circle of theater friends.;98;Joseph L. Mankiewicz;Bette Davis;Anne Baxter;George Sanders;Celeste Holm
https://m.media-amazon.com/images/M/MV5BOTJlZWMxYzEtMjlkMS00ODE0LThlM2ItMDI3NGQ2YjhmMzkxXkEyXkFqcGdeQXVyMDI2NDg0NQ@@._V1_UX67_CR0;The Treasure of the Sierra Madre;1948;Passed;126 min;Adventure, Drama, Western;08.feb;Two Americans searching for work in Mexico convince an old prospector to help them mine for gold in the Sierra Madre Mountains.;98;John Huston;Humphrey Bogart;Walter Huston;Tim Holt;Bruce Bennett
https://m.media-amazon.com/images/M/MV5BYTIwNDcyMjktMTczMy00NDM5LTlhNDEtMmE3NGVjOTM2YjQ3XkEyXkFqcGdeQXVyNjc0MzMzNjA@._V1_UX67_CR0;To Be or Not to Be;1942;Passed;99 min;Comedy, War;08.feb;During the Nazi occupation of Poland, an acting troupe becomes embroiled in a Polish soldier's efforts to track down a German spy.;86;Ernst Lubitsch;Carole Lombard;Jack Benny;Robert Stack;Felix Bressart
https://m.media-amazon.com/images/M/MV5BZjEyOTE4MzMtNmMzMy00Mzc3LWJlOTQtOGJiNDE0ZmJiOTU4L2ltYWdlXkEyXkFqcGdeQXVyNTAyODkwOQ@@._V1_UY98_CR2;The Gold Rush;1925;Passed;95 min;Adventure, Comedy, Drama;08.feb;A prospector goes to the Klondike in search of gold and finds it and more.;;Charles Chaplin;Charles Chaplin;Mack Swain;Tom Murray;Henry Bergman
https://m.media-amazon.com/images/M/MV5BZWFhOGU5NDctY2Q3YS00Y2VlLWI1NzEtZmIwY2ZiZjY4OTA2XkEyXkFqcGdeQXVyMDI2NDg0NQ@@._V1_UX67_CR0;Sherlock Jr.;1924;Passed;45 min;Action, Comedy, Romance;08.feb;A film projectionist longs to be a detective, and puts his meagre skills to work when he is framed by a rival for stealing his girlfriend's father's pocketwatch.;;Buster Keaton;Buster Keaton;Kathryn McGuire;Joe Keaton;Erwin Connelly
https://m.media-amazon.com/images/M/MV5BNjgwNjkwOWYtYmM3My00NzI1LTk5OGItYWY0OTMyZTY4OTg2XkEyXkFqcGdeQXVyODk4OTc3MTY@._V1_UX67_CR0;Portrait de la jeune fille en feu;2019;R;122 min;Drama, Romance;08.ian;On an isolated island in Brittany at the end of the eighteenth century, a female painter is obliged to paint a wedding portrait of a young woman.;95;Céline Sciamma;Noémie Merlant;Adèle Haenel;Luàna Bajrami;Valeria Golino
https://m.media-amazon.com/images/M/MV5BNGI1MTI1YTQtY2QwYi00YzUzLTg3NWYtNzExZDlhOTZmZWU0XkEyXkFqcGdeQXVyMDkwNTkwNg@@._V1_UY98_CR3;Pink;2016;UA;136 min;Drama, Thriller;08.ian;When three young women are implicated in a crime, a retired lawyer steps forward to help them clear their names.;;Aniruddha Roy Chowdhury;Taapsee Pannu;Amitabh Bachchan;Kirti Kulhari;Andrea Tariang
https://m.media-amazon.com/images/M/MV5BZGRkOGMxYTUtZTBhYS00NzI3LWEzMDQtOWRhMmNjNjJjMzM4XkEyXkFqcGdeQXVyMTMxODk2OTU@._V1_UY98_CR0;Koe no katachi;2016;16;130 min;Animation, Drama, Family;08.ian;A young man is ostracized by his classmates after he bullies a deaf girl to the point where she moves away. Years later, he sets off on a path for redemption.;78;Naoko Yamada;Miyu Irino;Saori Hayami;Aoi Yûki;Kenshô Ono
https://m.media-amazon.com/images/M/MV5BMDk0YzAwYjktMWFiZi00Y2FmLWJmMmMtMzUyZDZmMmU5MjkzXkEyXkFqcGdeQXVyMTMxODk2OTU@._V1_UY98_CR1;Contratiempo;2016;TV-MA;106 min;Crime, Drama, Mystery;08.ian;A successful entrepreneur accused of murder and a witness preparation expert have less than three hours to come up with an impregnable defense.;;Oriol Paulo;Mario Casas;Ana Wagener;Jose Coronado;Bárbara Lennie
https://m.media-amazon.com/images/M/MV5BNDJhYTk2MTctZmVmOS00OTViLTgxNjQtMzQxOTRiMDdmNGRjXkEyXkFqcGdeQXVyMTMxODk2OTU@._V1_UY98_CR0;Ah-ga-ssi;2016;A;145 min;Drama, Romance, Thriller;08.ian;A woman is hired as a handmaiden to a Japanese heiress, but secretly she is involved in a plot to defraud her.;84;Chan-wook Park;Kim Min-hee;Jung-woo Ha;Cho Jin-woong;Moon So-Ri
https://m.media-amazon.com/images/M/MV5BMGI3YWFmNDQtNjc0Ny00ZDBjLThlNjYtZTc1ZTk5MzU2YTVjXkEyXkFqcGdeQXVyNzA4ODc3ODU@._V1_UY98_CR1;Mommy;2014;R;139 min;Drama;08.ian;A widowed single mother, raising her violent son alone, finds new hope when a mysterious neighbor inserts herself into their household.;74;Xavier Dolan;Anne Dorval;Antoine Olivier Pilon;Suzanne Clément;Patrick Huard
https://m.media-amazon.com/images/M/MV5BMjA1NTEwMDMxMF5BMl5BanBnXkFtZTgwODkzMzI0MjE@._V1_UY98_CR0;Haider;2014;UA;160 min;Action, Crime, Drama;08.ian;A young man returns to Kashmir after his father's disappearance to confront his uncle, whom he suspects of playing a role in his father's fate.;;Vishal Bhardwaj;Shahid Kapoor;Tabu;Shraddha Kapoor;Kay Kay Menon
https://m.media-amazon.com/images/M/MV5BYzc5MTU4N2EtYTkyMi00NjdhLTg3NWEtMTY4OTEyMzJhZTAzXkEyXkFqcGdeQXVyNjc1NTYyMjg@._V1_UX67_CR0;Logan;2017;A;137 min;Action, Drama, Sci-Fi;08.ian;In a future where mutants are nearly extinct, an elderly and weary Logan leads a quiet life. But when Laura, a mutant child pursued by scientists, comes to him for help, he must get her to safety.;77;James Mangold;Hugh Jackman;Patrick Stewart;Dafne Keen;Boyd Holbrook
https://m.media-amazon.com/images/M/MV5BMjE4NzgzNzEwMl5BMl5BanBnXkFtZTgwMTMzMDE0NjE@._V1_UX67_CR0;Room;2015;R;118 min;Drama, Thriller;08.ian;Held captive for 7 years in an enclosed space, a woman and her young son finally gain their freedom, allowing the boy to experience the outside world for the first time.;86;Lenny Abrahamson;Brie Larson;Jacob Tremblay;Sean Bridgers;Wendy Crewson
https://m.media-amazon.com/images/M/MV5BNGQzY2Y0MTgtMDA4OC00NjM3LWI0ZGQtNTJlM2UxZDQxZjI0XkEyXkFqcGdeQXVyNDUzOTQ5MjY@._V1_UY98_CR1;Relatos salvajes;2014;R;122 min;Comedy, Drama, Thriller;08.ian;Six short stories that explore the extremities of human behavior involving people in distress.;77;Damián Szifron;Darío Grandinetti;María Marull;Mónica Villa;Diego Starosta
https://m.media-amazon.com/images/M/MV5BZGE1MDg5M2MtNTkyZS00MTY5LTg1YzUtZTlhZmM1Y2EwNmFmXkEyXkFqcGdeQXVyNjA3OTI0MDc@._V1_UX67_CR0;Soul;2020;U;100 min;Animation, Adventure, Comedy;08.ian;After landing the gig of a lifetime, a New York jazz pianist suddenly finds himself trapped in a strange land between Earth and the afterlife.;83;Pete Docter;Kemp Powers;Jamie Foxx;Tina Fey;Graham Norton
https://m.media-amazon.com/images/M/MV5BYzE2MjEwMTQtOTQ2Mi00ZWExLTkyMjUtNmJjMjBlYWFjZDdlXkEyXkFqcGdeQXVyMTI3ODAyMzE2._V1_UY98_CR0;Kis Uykusu;2014;;196 min;Drama;08.ian;A hotel owner and landlord in a remote Turkish village deals with conflicts within his family and a tenant behind on his rent.;88;Nuri Bilge Ceylan;Haluk Bilginer;Melisa Sözen;Demet Akbag;Ayberk Pekcan
https://m.media-amazon.com/images/M/MV5BMTYzOTE2NjkxN15BMl5BanBnXkFtZTgwMDgzMTg0MzE@._V1_UY98_CR0;PK;2014;UA;153 min;Comedy, Drama, Musical;08.ian;An alien on Earth loses the only device he can use to communicate with his spaceship. His innocent nature and child-like questions force the country to evaluate the impact of religion on its people.;;Rajkumar Hirani;Aamir Khan;Anushka Sharma;Sanjay Dutt;Boman Irani
https://m.media-amazon.com/images/M/MV5BMGNhYjUwNmYtNDQxNi00NDdmLTljMDAtZWM1NDQyZTk3ZDYwXkEyXkFqcGdeQXVyODE5NzE3OTE@._V1_UY98_CR0;OMG: Oh My God!;2012;U;125 min;Comedy, Drama, Fantasy;08.ian;A shopkeeper takes God to court when his shop is destroyed by an earthquake.;;Umesh Shukla;Paresh Rawal;Akshay Kumar;Mithun Chakraborty;Mahesh Manjrekar
https://m.media-amazon.com/images/M/MV5BMzM5NjUxOTEyMl5BMl5BanBnXkFtZTgwNjEyMDM0MDE@._V1_UX67_CR0;The Grand Budapest Hotel;2014;UA;99 min;Adventure, Comedy, Crime;08.ian;A writer encounters the owner of an aging high-class hotel, who tells him of his early years serving as a lobby boy in the hotel's glorious years under an exceptional concierge.;88;Wes Anderson;Ralph Fiennes;F. Murray Abraham;Mathieu Amalric;Adrien Brody
https://m.media-amazon.com/images/M/MV5BMTk0MDQ3MzAzOV5BMl5BanBnXkFtZTgwNzU1NzE3MjE@._V1_UX67_CR0;Gone Girl;2014;A;149 min;Drama, Mystery, Thriller;08.ian;With his wife's disappearance having become the focus of an intense media circus, a man sees the spotlight turned on him when it's suspected that he may not be innocent.;79;David Fincher;Ben Affleck;Rosamund Pike;Neil Patrick Harris;Tyler Perry
https://m.media-amazon.com/images/M/MV5BYzQxNDZhNDUtNDUwOC00NjQyLTg2OWUtZWVlYThjYjYyMTc2XkEyXkFqcGdeQXVyNTAyODkwOQ@@._V1_UY98_CR1;Ôkami kodomo no Ame to Yuki;2012;U;117 min;Animation, Drama, Fantasy;08.ian;After her werewolf lover unexpectedly dies in an accident while hunting for food for their children, a young woman must find ways to raise the werewolf son and daughter that she had with him while keeping their trait hidden from society.;71;Mamoru Hosoda;Aoi Miyazaki;Takao Osawa;Haru Kuroki;Yukito Nishii
https://m.media-amazon.com/images/M/MV5BMjQ1NjM3MTUxNV5BMl5BanBnXkFtZTgwMDc5MTY5OTE@._V1_UX67_CR0;Hacksaw Ridge;2016;A;139 min;Biography, Drama, History;08.ian;World War II American Army Medic Desmond T. Doss, who served during the Battle of Okinawa, refuses to kill people, and becomes the first man in American history to receive the Medal of Honor without firing a shot.;71;Mel Gibson;Andrew Garfield;Sam Worthington;Luke Bracey;Teresa Palmer
https://m.media-amazon.com/images/M/MV5BOTgxMDQwMDk0OF5BMl5BanBnXkFtZTgwNjU5OTg2NDE@._V1_UX67_CR0;Inside Out;2015;U;95 min;Animation, Adventure, Comedy;08.ian;After young Riley is uprooted from her Midwest life and moved to San Francisco, her emotions - Joy, Fear, Anger, Disgust and Sadness - conflict on how best to navigate a new city, house, and school.;94;Pete Docter;Ronnie Del Carmen;Amy Poehler;Bill Hader;Lewis Black
https://m.media-amazon.com/images/M/MV5BMTQzMTEyODY2Ml5BMl5BanBnXkFtZTgwMjA0MDUyMjE@._V1_UY98_CR0;Barfi!;2012;U;151 min;Comedy, Drama, Romance;08.ian;Three young people learn that love can neither be defined nor contained by society's definition of normal and abnormal.;;Anurag Basu;Ranbir Kapoor;Priyanka Chopra;Ileana D'Cruz;Saurabh Shukla
https://m.media-amazon.com/images/M/MV5BMjExMTEzODkyN15BMl5BanBnXkFtZTcwNTU4NTc4OQ@@._V1_UX67_CR0;12 Years a Slave;2013;A;134 min;Biography, Drama, History;08.ian;In the antebellum United States, Solomon Northup, a free black man from upstate New York, is abducted and sold into slavery.;96;Steve McQueen;Chiwetel Ejiofor;Michael Kenneth Williams;Michael Fassbender;Brad Pitt
https://m.media-amazon.com/images/M/MV5BOWEwODJmZDItYTNmZC00OGM4LThlNDktOTQzZjIzMGQxODA4XkEyXkFqcGdeQXVyNjU0OTQ0OTY@._V1_UX67_CR0;Rush;2013;UA;123 min;Action, Biography, Drama;08.ian;The merciless 1970s rivalry between Formula One rivals James Hunt and Niki Lauda.;74;Ron Howard;Daniel Brühl;Chris Hemsworth;Olivia Wilde;Alexandra Maria Lara
https://m.media-amazon.com/images/M/MV5BM2UwMDVmMDItM2I2Yi00NGZmLTk4ZTUtY2JjNTQ3OGQ5ZjM2XkEyXkFqcGdeQXVyMTA1OTYzOTUx._V1_UX67_CR0;Ford v Ferrari;2019;UA;152 min;Action, Biography, Drama;08.ian;American car designer Carroll Shelby and driver Ken Miles battle corporate interference and the laws of physics to build a revolutionary race car for Ford in order to defeat Ferrari at the 24 Hours of Le Mans in 1966.;81;James Mangold;Matt Damon;Christian Bale;Jon Bernthal;Caitriona Balfe
https://m.media-amazon.com/images/M/MV5BMjIyOTM5OTIzNV5BMl5BanBnXkFtZTgwMDkzODE2NjE@._V1_UX67_CR0;Spotlight;2015;A;129 min;Biography, Crime, Drama;08.ian;The true story of how the Boston Globe uncovered the massive scandal of child molestation and cover-up within the local Catholic Archdiocese, shaking the entire Catholic Church to its core.;93;Tom McCarthy;Mark Ruffalo;Michael Keaton;Rachel McAdams;Liev Schreiber
https://m.media-amazon.com/images/M/MV5BMTQ2MDMwNjEwNV5BMl5BanBnXkFtZTgwOTkxMzI0MzE@._V1_UY98_CR0;Song of the Sea;2014;PG;93 min;Animation, Adventure, Drama;08.ian;Ben, a young Irish boy, and his little sister Saoirse, a girl who can turn into a seal, go on an adventure to free the fairies and save the spirit world.;85;Tomm Moore;David Rawle;Brendan Gleeson;Lisa Hannigan;Fionnula Flanagan
https://m.media-amazon.com/images/M/MV5BMTQ1NDI0NzkyOF5BMl5BanBnXkFtZTcwNzAyNzE2Nw@@._V1_UY98_CR0;Kahaani;2012;UA;122 min;Mystery, Thriller;08.ian;A pregnant woman's search for her missing husband takes her from London to Kolkata, but everyone she questions denies having ever met him.;;Sujoy Ghosh;Vidya Balan;Parambrata Chattopadhyay;Indraneil Sengupta;Nawazuddin Siddiqui
https://m.media-amazon.com/images/M/MV5BZGFmMjM5OWMtZTRiNC00ODhlLThlYTItYTcyZDMyYmMyYjFjXkEyXkFqcGdeQXVyNDUzOTQ5MjY@._V1_UY98_CR0;Zindagi Na Milegi Dobara;2011;U;155 min;Comedy, Drama;08.ian;Three friends decide to turn their fantasy vacation into reality after one of their friends gets engaged.;;Zoya Akhtar;Hrithik Roshan;Farhan Akhtar;Abhay Deol;Katrina Kaif
https://m.media-amazon.com/images/M/MV5BMTg0NTIzMjQ1NV5BMl5BanBnXkFtZTcwNDc3MzM5OQ@@._V1_UX67_CR0;Prisoners;2013;A;153 min;Crime, Drama, Mystery;08.ian;When Keller Dover's daughter and her friend go missing, he takes matters into his own hands as the police pursue multiple leads and the pressure mounts.;70;Denis Villeneuve;Hugh Jackman;Jake Gyllenhaal;Viola Davis;Melissa Leo
https://m.media-amazon.com/images/M/MV5BN2EwM2I5OWMtMGQyMi00Zjg1LWJkNTctZTdjYTA4OGUwZjMyXkEyXkFqcGdeQXVyMTMxODk2OTU@._V1_UX67_CR0;Mad Max: Fury Road;2015;UA;120 min;Action, Adventure, Sci-Fi;08.ian;In a post-apocalyptic wasteland, a woman rebels against a tyrannical ruler in search for her homeland with the aid of a group of female prisoners, a psychotic worshiper, and a drifter named Max.;90;George Miller;Tom Hardy;Charlize Theron;Nicholas Hoult;Zoë Kravitz
https://m.media-amazon.com/images/M/MV5BOTcwMzdiMWItMjZlOS00MzAzLTg5OTItNTA4OGYyMjBhMmRiXkEyXkFqcGdeQXVyODE5NzE3OTE@._V1_UY98_CR1;A Wednesday;2008;UA;104 min;Action, Crime, Drama;08.ian;A retiring police officer reminisces about the most astounding day of his career. About a case that was never filed but continues to haunt him in his memories - the case of a man and a Wednesday.;;Neeraj Pandey;Anupam Kher;Naseeruddin Shah;Jimmy Sheirgill;Aamir Bashir
https://m.media-amazon.com/images/M/MV5BMTc5NTk2OTU1Nl5BMl5BanBnXkFtZTcwMDc3NjAwMg@@._V1_UX67_CR0;Gran Torino;2008;R;116 min;Drama;08.ian;Disgruntled Korean War veteran Walt Kowalski sets out to reform his neighbor, Thao Lor, a Hmong teenager who tried to steal Kowalski's prized possession: a 1972 Gran Torino.;72;Clint Eastwood;Clint Eastwood;Bee Vang;Christopher Carley;Ahney Her
https://m.media-amazon.com/images/M/MV5BMGVmMWNiMDktYjQ0Mi00MWIxLTk0N2UtN2ZlYTdkN2IzNDNlXkEyXkFqcGdeQXVyODE5NzE3OTE@._V1_UX67_CR0;Harry Potter and the Deathly Hallows: Part 2;2011;UA;130 min;Adventure, Drama, Fantasy;08.ian;Harry, Ron, and Hermione search for Voldemort's remaining Horcruxes in their effort to destroy the Dark Lord as the final battle rages on at Hogwarts.;85;David Yates;Daniel Radcliffe;Emma Watson;Rupert Grint;Michael Gambon
https://m.media-amazon.com/images/M/MV5BMTUzOTcwOTA2NV5BMl5BanBnXkFtZTcwNDczMzczMg@@._V1_UY98_CR0;Okuribito;2008;PG-13;130 min;Drama, Music;08.ian;A newly unemployed cellist takes a job preparing the dead for funerals.;68;Yôjirô Takita;Masahiro Motoki;Ryôko Hirosue;Tsutomu Yamazaki;Kazuko Yoshiyuki
https://m.media-amazon.com/images/M/MV5BNzE4NDg5OWMtMzg3NC00ZDRjLTllMDMtZTRjNWZmNjBmMGZlXkEyXkFqcGdeQXVyMTMxODk2OTU@._V1_UY98_CR1;Hachi: A Dog's Tale;2009;G;93 min;Biography, Drama, Family;08.ian;A college professor bonds with an abandoned dog he takes into his home.;;Lasse Hallström;Richard Gere;Joan Allen;Cary-Hiroyuki Tagawa;Sarah Roemer
https://m.media-amazon.com/images/M/MV5BMDgzYjQwMDMtNGUzYi00MTRmLWIyMGMtNjE1OGZkNzY2YWIzL2ltYWdlXkEyXkFqcGdeQXVyNjU0OTQ0OTY@._V1_UY98_CR1;Mary and Max;2009;;92 min;Animation, Comedy, Drama;08.ian;A tale of friendship between two unlikely pen pals: Mary, a lonely, eight-year-old girl living in the suburbs of Melbourne, and Max, a forty-four-year old, severely obese man living in New York.;;Adam Elliot;Toni Collette;Philip Seymour Hoffman;Eric Bana;Barry Humphries
https://m.media-amazon.com/images/M/MV5BMjA5NDQyMjc2NF5BMl5BanBnXkFtZTcwMjg5ODcyMw@@._V1_UX67_CR0;How to Train Your Dragon;2010;U;98 min;Animation, Action, Adventure;08.ian;A hapless young Viking who aspires to hunt dragons becomes the unlikely friend of a young dragon himself, and learns there may be more to the creatures than he assumed.;75;Dean DeBlois;Chris Sanders;Jay Baruchel;Gerard Butler;Christopher Mintz-Plasse
https://m.media-amazon.com/images/M/MV5BMTAwNDEyODU1MjheQTJeQWpwZ15BbWU2MDc3NDQwNw@@._V1_UX67_CR0;Into the Wild;2007;R;148 min;Adventure, Biography, Drama;08.ian;After graduating from Emory University, top student and athlete Christopher McCandless abandons his possessions, gives his entire $24,000 savings account to charity and hitchhikes to Alaska to live in the wilderness. Along the way, Christopher encounters a series of characters that shape his life.;73;Sean Penn;Emile Hirsch;Vince Vaughn;Catherine Keener;Marcia Gay Harden
https://m.media-amazon.com/images/M/MV5BMjA5Njk3MjM4OV5BMl5BanBnXkFtZTcwMTc5MTE1MQ@@._V1_UX67_CR0;No Country for Old Men;2007;R;122 min;Crime, Drama, Thriller;08.ian;Violence and mayhem ensue after a hunter stumbles upon a drug deal gone wrong and more than two million dollars in cash near the Rio Grande.;91;Ethan Coen;Joel Coen;Tommy Lee Jones;Javier Bardem;Josh Brolin
https://m.media-amazon.com/images/M/MV5BN2ZmMDMwODgtMzA5MS00MGU0LWEyYTgtYzQ5MmQzMzU2NTVkXkEyXkFqcGdeQXVyODE5NzE3OTE@._V1_UY98_CR0;Lage Raho Munna Bhai;2006;U;144 min;Comedy, Drama, Romance;08.ian;Munna Bhai embarks on a journey with Mahatma Gandhi in order to fight against a corrupt property dealer.;;Rajkumar Hirani;Sanjay Dutt;Arshad Warsi;Vidya Balan;Boman Irani
https://m.media-amazon.com/images/M/MV5BMTkxNzA1NDQxOV5BMl5BanBnXkFtZTcwNTkyMTIzMw@@._V1_UX67_CR0;Million Dollar Baby;2004;UA;132 min;Drama, Sport;08.ian;A determined woman works with a hardened boxing trainer to become a professional.;86;Clint Eastwood;Hilary Swank;Clint Eastwood;Morgan Freeman;Jay Baruchel
https://m.media-amazon.com/images/M/MV5BZGJjYmIzZmQtNWE4Yy00ZGVmLWJkZGEtMzUzNmQ4ZWFlMjRhXkEyXkFqcGdeQXVyMTMxODk2OTU@._V1_UX67_CR0;Hotel Rwanda;2004;PG-13;121 min;Biography, Drama, History;08.ian;Paul Rusesabagina, a hotel manager, houses over a thousand Tutsi refugees during their struggle against the Hutu militia in Rwanda, Africa.;79;Terry George;Don Cheadle;Sophie Okonedo;Joaquin Phoenix;Xolani Mali
https://m.media-amazon.com/images/M/MV5BNjAxZTEzNzQtYjdlNy00ZTJmLTkwZDUtOTAwNTM3YjI2MWUyL2ltYWdlXkEyXkFqcGdeQXVyNTAyODkwOQ@@._V1_UX67_CR0;Taegukgi hwinalrimyeo;2004;R;140 min;Action, Drama, War;08.ian;When two brothers are forced to fight in the Korean War, the elder decides to take the riskiest missions if it will help shield the younger from battle.;64;Je-kyu Kang;Jang Dong-Gun;Won Bin;Eun-ju Lee;Hyeong-jin Kong
https://m.media-amazon.com/images/M/MV5BMTQ1MjAwNTM5Ml5BMl5BanBnXkFtZTYwNDM0MTc3._V1_UX67_CR0;Before Sunset;2004;R;80 min;Drama, Romance;08.ian;Nine years after Jesse and Celine first met, they encounter each other again on the French leg of Jesse's book tour.;90;Richard Linklater;Ethan Hawke;Julie Delpy;Vernon Dobtcheff;Louise Lemoine Torrès
https://m.media-amazon.com/images/M/MV5BMzQ4MTBlYTQtMzJkYS00OGNjLTk1MWYtNzQ0OTQ0OWEyOWU1XkEyXkFqcGdeQXVyNDgyODgxNjE@._V1_UY98_CR1;Munna Bhai M.B.B.S.;2003;U;156 min;Comedy, Drama, Musical;08.ian;A gangster sets out to fulfill his father's dream of becoming a doctor.;;Rajkumar Hirani;Sanjay Dutt;Arshad Warsi;Gracy Singh;Sunil Dutt
https://m.media-amazon.com/images/M/MV5BOGViNTg4YTktYTQ2Ni00MTU0LTk2NWUtMTI4OTc1YTM0NzQ2XkEyXkFqcGdeQXVyMDM2NDM2MQ@@._V1_UX67_CR0;Salinui chueok;2003;UA;131 min;Crime, Drama, Mystery;08.ian;In a small Korean province in 1986, two detectives struggle with the case of multiple young women being found raped and murdered by an unknown culprit.;82;Bong Joon Ho;Kang-ho Song;Kim Sang-kyung;Roe-ha Kim;Jae-ho Song
https://m.media-amazon.com/images/M/MV5BMjRjMTYwMTYtMmRkNi00MmVkLWE0MjQtNmM3YjI0NWFhZDNmXkEyXkFqcGdeQXVyODE5NzE3OTE@._V1_UX67_CR0;Dil Chahta Hai;2001;Unrated;183 min;Comedy, Drama, Romance;08.ian;Three inseparable childhood friends are just out of college. Nothing comes between them - until they each fall in love, and their wildly different approaches to relationships creates tension.;;Farhan Akhtar;Aamir Khan;Saif Ali Khan;Akshaye Khanna;Preity Zinta
https://m.media-amazon.com/images/M/MV5BNzM3NDFhYTAtYmU5Mi00NGRmLTljYjgtMDkyODQ4MjNkMGY2XkEyXkFqcGdeQXVyNzkwMjQ5NzM@._V1_UX67_CR0;Kill Bill: Vol. 1;2003;R;111 min;Action, Crime, Drama;08.ian;After awakening from a four-year coma, a former assassin wreaks vengeance on the team of assassins who betrayed her.;69;Quentin Tarantino;Uma Thurman;David Carradine;Daryl Hannah;Michael Madsen
https://m.media-amazon.com/images/M/MV5BZTAzNWZlNmUtZDEzYi00ZjA5LWIwYjEtZGM1NWE1MjE4YWRhXkEyXkFqcGdeQXVyNjU0OTQ0OTY@._V1_UX67_CR0;Finding Nemo;2003;U;100 min;Animation, Adventure, Comedy;08.ian;After his son is captured in the Great Barrier Reef and taken to Sydney, a timid clownfish sets out on a journey to bring him home.;90;Andrew Stanton;Lee Unkrich;Albert Brooks;Ellen DeGeneres;Alexander Gould
https://m.media-amazon.com/images/M/MV5BMTY5MzYzNjc5NV5BMl5BanBnXkFtZTYwNTUyNTc2._V1_UX67_CR0;Catch Me If You Can;2002;A;141 min;Biography, Crime, Drama;08.ian;Barely 21 yet, Frank is a skilled forger who has passed as a doctor, lawyer and pilot. FBI agent Carl becomes obsessed with tracking down the con man, who only revels in the pursuit.;75;Steven Spielberg;Leonardo DiCaprio;Tom Hanks;Christopher Walken;Martin Sheen
https://m.media-amazon.com/images/M/MV5BMjQxMWJhMzMtMzllZi00NzMwLTllYjktNTcwZmU4ZmU3NTA0XkEyXkFqcGdeQXVyMTAzMDM4MjM0._V1_UY98_CR3;Amores perros;2000;A;154 min;Drama, Thriller;08.ian;A horrific car accident connects three stories, each involving characters dealing with loss, regret, and life's harsh realities, all in the name of love.;83;Alejandro G. Iñárritu;Emilio Echevarría;Gael García Bernal;Goya Toledo;Álvaro Guerrero
https://m.media-amazon.com/images/M/MV5BMTY1NTI0ODUyOF5BMl5BanBnXkFtZTgwNTEyNjQ0MDE@._V1_UX67_CR0;Monsters, Inc.;2001;U;92 min;Animation, Adventure, Comedy;08.ian;In order to power the city, monsters have to scare children so that they scream. However, the children are toxic to the monsters, and after a child gets through, 2 monsters realize things may not be what they think.;79;Pete Docter;David Silverman;Lee Unkrich;Billy Crystal;John Goodman
https://m.media-amazon.com/images/M/MV5BZjJhMThkNTQtNjkxNy00MDdjLTg4MWQtMTI2MmQ3MDVmODUzXkEyXkFqcGdeQXVyMTAwOTA3NzY3._V1_UY98_CR1;Shin seiki Evangelion Gekijô-ban: Air/Magokoro wo, kimi ni;1997;UA;87 min;Animation, Action, Drama;08.ian;Concurrent theatrical ending of the TV series Shin seiki evangerion (1995).;;Hideaki Anno;Kazuya Tsurumaki;Megumi Ogata;Megumi Hayashibara;Yûko Miyamura
https://m.media-amazon.com/images/M/MV5BNDYxNWUzZmYtOGQxMC00MTdkLTkxOTctYzkyOGIwNWQxZjhmXkEyXkFqcGdeQXVyNjU0OTQ0OTY@._V1_UX67_CR0;Lagaan: Once Upon a Time in India;2001;U;224 min;Adventure, Drama, Musical;08.ian;The people of a small village in Victorian India stake their future on a game of cricket against their ruthless British rulers.;84;Ashutosh Gowariker;Aamir Khan;Raghuvir Yadav;Gracy Singh;Rachel Shelley
https://m.media-amazon.com/images/M/MV5BMWM4NTFhYjctNzUyNi00NGMwLTk3NTYtMDIyNTZmMzRlYmQyXkEyXkFqcGdeQXVyMTAwMzUyOTc@._V1_UX67_CR0;The Sixth Sense;1999;A;107 min;Drama, Mystery, Thriller;08.ian;A boy who communicates with spirits seeks the help of a disheartened child psychologist.;64;M. Night Shyamalan;Bruce Willis;Haley Joel Osment;Toni Collette;Olivia Williams
https://m.media-amazon.com/images/M/MV5BMzIwOTdmNjQtOWQ1ZS00ZWQ4LWIxYTMtOWFkM2NjODJiMGY4L2ltYWdlL2ltYWdlXkEyXkFqcGdeQXVyNTI4MjkwNjA@._V1_UX67_CR0;La leggenda del pianista sull'oceano;1998;U;169 min;Drama, Music, Romance;08.ian;A baby boy, discovered in 1900 on an ocean liner, grows into a musical prodigy, never setting foot on land.;58;Giuseppe Tornatore;Tim Roth;Pruitt Taylor Vince;Mélanie Thierry;Bill Nunn
https://m.media-amazon.com/images/M/MV5BMDIzODcyY2EtMmY2MC00ZWVlLTgwMzAtMjQwOWUyNmJjNTYyXkEyXkFqcGdeQXVyNDk3NzU2MTQ@._V1_UX67_CR0;The Truman Show;1998;U;103 min;Comedy, Drama;08.ian;An insurance salesman discovers his whole life is actually a reality TV show.;90;Peter Weir;Jim Carrey;Ed Harris;Laura Linney;Noah Emmerich
https://m.media-amazon.com/images/M/MV5BMmExZTZhN2QtMzg5Mi00Y2M5LTlmMWYtNTUzMzUwMGM2OGQ3XkEyXkFqcGdeQXVyNTA4NzY1MzY@._V1_UX67_CR0;Crna macka, beli macor;1998;R;127 min;Comedy, Crime, Romance;08.ian;Matko and his son Zare live on the banks of the Danube river and get by through hustling and basically doing anything to make a living. In order to pay off a business debt Matko agrees to marry off Zare to the sister of a local gangster.;73;Emir Kusturica;Bajram Severdzan;Srdjan 'Zika' Todorovic;Branka Katic;Florijan Ajdini
https://m.media-amazon.com/images/M/MV5BMTQ0NjUzMDMyOF5BMl5BanBnXkFtZTgwODA1OTU0MDE@._V1_UX67_CR0;The Big Lebowski;1998;R;117 min;Comedy, Crime, Sport;08.ian;"Jeff ""The Dude"" Lebowski, mistaken for a millionaire of the same name, seeks restitution for his ruined rug and enlists his bowling buddies to help get it.";71;Joel Coen;Ethan Coen;Jeff Bridges;John Goodman;Julianne Moore
